{
  "schema_version": 1,
  "label": "camera-lidar-drone-stress-smoke",
  "launch": {
    "program": "gz",
    "args": [
      "sim",
      "-s",
      "-r",
      "--headless-rendering",
      "examples/camera-lidar-stress-world.sdf"
    ],
    "environment": {}
  },
  "stats_topic": "/world/simopt_sensor_stress/stats",
  "required_topics": ["/simopt/stress/camera", "/simopt/stress/down_camera", "/simopt/stress/lidar", "/simopt/stress/imu"],
  "message_check_topics": ["/simopt/stress/camera", "/simopt/stress/down_camera", "/simopt/stress/lidar", "/simopt/stress/imu"],
  "load_topics": ["/simopt/stress/camera", "/simopt/stress/down_camera", "/simopt/stress/lidar"],
  "load_subscriber": {"program": "target/gz-topic-sink", "args": ["{topic}"], "environment": {}},
  "working_directory": "../..",
  "gz_command": "gz",
  "warmup_seconds": 3.0,
  "duration_seconds": 5.0,
  "repeats": 1,
  "startup_timeout_seconds": 45.0,
  "message_timeout_seconds": 30.0,
  "shutdown_grace_seconds": 5.0,
  "inter_run_delay_seconds": 0.0,
  "window_seconds": 1.0,
  "collect_process_metrics": true,
  "resource_sample_interval_ms": 250,
  "collect_capabilities": true,
  "fingerprint_files": ["examples/camera-lidar-stress-world.sdf"]
}
